{
  "indexVersion": "0.1",
  "name": "Example community index",
  "homepage": "https://example.org/hyprune",
  "serial": 1842,
  "generated": "2026-11-02T08:00:00Z",
  "successor": null,
  "entries": [
    {
      "id": "io.github.example-creator.tidepool",
      "type": "world",
      "name": "Tidepool Station",
      "summary": "A tidal research station with four workspace homes and a pier.",
      "description": "Four connected homes around a flooded atrium.\nA pier with a long view.",
      "creator": "example-creator",
      "repo": "https://github.com/example-creator/tidepool-world",
      "tags": [
        "water",
        "station"
      ],
      "versions": [
        {
          "tag": "v1.2.0",
          "version": "1.2.0",
          "formatVersion": "0.9",
          "published": "2026-11-01",
          "license": "CC-BY-SA-4.0",
          "url": "https://github.com/example-creator/tidepool-world/releases/download/v1.2.0/io.github.example-creator.tidepool-1.2.0.tar.zst",
          "sha256": "5d2f0c6e3b9a41d8e7c2b0f4a6d9e1c3b5a7f9e2d4c6b8a0f1e3d5c7b9a2e4f6",
          "bytes": 48213004,
          "expandedBytes": 96424960,
          "files": 212,
          "record": {
            "url": "https://github.com/example-creator/tidepool-world/releases/download/v1.2.0/io.github.example-creator.tidepool-1.2.0.release.json",
            "sha256": "9a1c3e5f7b9d0a2c4e6f8b1d3a5c7e9f0b2d4a6c8e1f3b5d7a9c0e2f4b6d8a1c"
          },
          "requires": {
            "libraries": [
              "com.example.street@1.2.0"
            ]
          },
          "thumbnails": [
            {
              "url": "https://github.com/example-creator/tidepool-world/releases/download/v1.2.0/io.github.example-creator.tidepool-1.2.0.thumb-1.png",
              "sha256": "0b8e4c2a6f1d3e5b7a9c0d2e4f6a8b1c3d5e7f9a0b2c4d6e8f1a3b5c7d9e0f2a",
              "width": 1280,
              "height": 720
            }
          ],
          "status": "available"
        },
        {
          "tag": "v1.2.0-rc.1",
          "version": "1.2.0-rc.1",
          "formatVersion": "0.9",
          "published": "2026-10-28",
          "license": "CC-BY-SA-4.0",
          "url": "https://github.com/example-creator/tidepool-world/releases/download/v1.2.0-rc.1/io.github.example-creator.tidepool-1.2.0-rc.1.tar.zst",
          "sha256": "5d2f0c6e3b9a41d8e7c2b0f4a6d9e1c3b5a7f9e2d4c6b8a0f1e3d5c7b9a2e4f6",
          "bytes": 48213004,
          "expandedBytes": 96424960,
          "files": 212,
          "record": {
            "url": "https://github.com/example-creator/tidepool-world/releases/download/v1.2.0-rc.1/io.github.example-creator.tidepool-1.2.0-rc.1.release.json",
            "sha256": "9a1c3e5f7b9d0a2c4e6f8b1d3a5c7e9f0b2d4a6c8e1f3b5d7a9c0e2f4b6d8a1c"
          },
          "requires": {
            "libraries": [
              "com.example.street@1.2.0"
            ]
          },
          "thumbnails": [
            {
              "url": "https://github.com/example-creator/tidepool-world/releases/download/v1.2.0-rc.1/io.github.example-creator.tidepool-1.2.0-rc.1.thumb-1.png",
              "sha256": "0b8e4c2a6f1d3e5b7a9c0d2e4f6a8b1c3d5e7f9a0b2c4d6e8f1a3b5c7d9e0f2a",
              "width": 1280,
              "height": 720
            }
          ],
          "status": "available"
        },
        {
          "tag": "v1.1.0",
          "version": "1.1.0",
          "formatVersion": "0.9",
          "published": "2026-10-20",
          "license": "CC-BY-SA-4.0",
          "url": "https://github.com/example-creator/tidepool-world/releases/download/v1.1.0/io.github.example-creator.tidepool-1.1.0.tar.zst",
          "sha256": "5d2f0c6e3b9a41d8e7c2b0f4a6d9e1c3b5a7f9e2d4c6b8a0f1e3d5c7b9a2e4f6",
          "bytes": 48213004,
          "expandedBytes": 96424960,
          "files": 212,
          "record": {
            "url": "https://github.com/example-creator/tidepool-world/releases/download/v1.1.0/io.github.example-creator.tidepool-1.1.0.release.json",
            "sha256": "9a1c3e5f7b9d0a2c4e6f8b1d3a5c7e9f0b2d4a6c8e1f3b5d7a9c0e2f4b6d8a1c"
          },
          "requires": {
            "libraries": [
              "com.example.street@1.2.0"
            ]
          },
          "thumbnails": [
            {
              "url": "https://github.com/example-creator/tidepool-world/releases/download/v1.1.0/io.github.example-creator.tidepool-1.1.0.thumb-1.png",
              "sha256": "0b8e4c2a6f1d3e5b7a9c0d2e4f6a8b1c3d5e7f9a0b2c4d6e8f1a3b5c7d9e0f2a",
              "width": 1280,
              "height": 720
            }
          ],
          "status": "available"
        }
      ]
    },
    {
      "id": "com.example.street",
      "type": "library",
      "name": "Street kit",
      "summary": "Lanterns and benches.",
      "creator": "example-org",
      "repo": "https://github.com/example-org/hyprune-objects",
      "versions": [
        {
          "tag": "street-v1.2.0",
          "version": "1.2.0",
          "formatVersion": "0.10",
          "published": "2026-10-30",
          "license": "CC0-1.0",
          "url": "https://github.com/example-org/hyprune-objects/releases/download/street-v1.2.0/com.example.street-1.2.0.tar.zst",
          "sha256": "5d2f0c6e3b9a41d8e7c2b0f4a6d9e1c3b5a7f9e2d4c6b8a0f1e3d5c7b9a2e4f6",
          "bytes": 3108221,
          "expandedBytes": 7340032,
          "files": 24
        }
      ]
    }
  ]
}
